{
  "schema_version": "0.2",
  "subject_digest": "sha256:7158f9b926ed4005bbae6566bef7f5d0d1d98e3e00857aabd8f6709cab685aa1",
  "chain_id": "11155111",
  "safe_address": "0x1111111111111111111111111111111111111111",
  "safe_nonce": "7",
  "transaction": {
    "to": "0x4444444444444444444444444444444444444444",
    "value": "0",
    "data": "0xa9059cbb0000000000000000000000002222222222222222222222222222222222222222000000000000000000000000000000000000000000000000000000000ee6b280",
    "operation": 0
  }
}
